disciplina;materia;banca;dificuldade;enunciado;alternativa_a;alternativa_b;alternativa_c;alternativa_d;alternativa_e;resposta_correta;justificativa;dica;formula
Direito Administrativo;Contratos de Concessão;Banca Padrão;Difícil;"O Supremo Tribunal Federal julgou, em 2022, a Ação Direta de Inconstitucionalidade 2946, proposta em relação ao Art. 27 da Lei nº 8987/1995, in verbis: Art. 27. A transferência de concessão ou do controle societário da concessionária sem prévia anuência do poder concedente implicará a caducidade da concessão. § 1o Para fins de obtenção da anuência de que trata o caput deste artigo, o pretendente deverá: I - atender às exigências de capacidade técnica, idoneidade financeira e regularidade jurídica e fiscal necessárias à assunção do serviço; e II - comprometer-se a cumprir todas as cláusulas do contrato em vigor.” Discutia-se se este artigo é compatível com o Art. 175 da Constituição Federal, a seguir. “Art. 175. Incumbe ao Poder Público, na forma da lei, diretamente ou sob regime de concessão ou permissão, sempre através de licitação, a prestação de serviços públicos. Parágrafo único. A lei disporá sobre: I - o regime das empresas concessionárias e permissionárias de serviços públicos, o caráter especial de seu contrato e de sua prorrogação, bem como as condições de caducidade, fiscalização e rescisão da concessão ou permissão; II - os direitos dos usuários; III - política tarifária; IV - a obrigação de manter serviço adequado. No voto do relator, que obteve a adesão da maioria do STF, lê-se o seguinte: É a proposta mais vantajosa que, prima facie, vincula a Administração. Mantidos seus termos, não se pode afirmar que a modificação do particular contratado implica, automática e necessariamente, burla à regra da obrigatoriedade de licitação ou ofensa aos princípios constitucionais correlatos, mormente nos casos de concessão, dada a natureza incompleta e dinâmica desses contratos e a necessidade de se zelar pela continuidade da prestação adequada dos serviços públicos. Assinale a opção que traduz a ideia expressa pelo Tribunal no trecho destacado.";Contratos de concessão têm natureza incompleta, dinâmica, especial, personalíssima e contínua.;A transferência de concessão é viável se houver continuidade da prestação adequada dos serviços públicos, mas deve ser feita sempre por meio de licitação.;Na concessão, o principal para a Administração Pública é a manutenção das condições contratuais obtidas na licitação e a continuidade adequada dos serviços, e não o interesse da concessionária vencedora.;A competência do poder concedente para anuir com a transferência da concessão está sujeita a caducidade, salvo se os termos da proposta mais vantajosa na licitação não tiverem sido mantidos.;Em virtude do princípio da continuidade dos serviços públicos, a Administração Pública deve necessariamente rescindir a concessão se a concessionária não tiver condições de manter a prestação adequada.;c;O STF entende que a transferência da concessão não fere a licitação se mantidas as condições originais e a continuidade do serviço, pois o contrato de concessão é dinâmico e a continuidade é essencial.;A essência da concessão é a continuidade do serviço público.;Não se aplica.
Direito Administrativo;Lei Anticorrupção (Lei 12.846/2013);Banca Padrão;Médio;Há uma década, foi editada lei que pretende resguardar as várias administrações contra atos que possam ser qualificados como “de corrupção”. Trata-se da Lei nº 12.846, de agosto de 2013, que objetiva proteger tanto administrações públicas nacionais quanto estrangeiras em face de atos praticados por pessoas jurídicas que atentem contra os seus respectivos patrimônios, ou que comprometam princípios, entre outras situações. Sobre a legislação mencionada, assinale a afirmativa correta.;Sempre que a pessoa jurídica for responsabilizada, os seus dirigentes ou administradores o serão de forma objetiva.;A responsabilização da pessoa jurídica exclui a responsabilidade individual de seus dirigentes ou administradores.;As pessoas jurídicas serão responsabilizadas objetivamente, nos âmbitos administrativo e civil, pelos atos previstos na mencionada lei.;A pessoa jurídica apenas poderá ser responsabilizada se houver a responsabilização individual de seus dirigentes ou administradores.;Caso haja fusão ou incorporação da empresa, a responsabilidade da sucessora continuará ampla e gerará a responsabilidade direta dos seus dirigentes ou administradores objetivamente.;c;A Lei Anticorrupção estabelece responsabilidade objetiva da pessoa jurídica nos âmbitos administrativo e civil, independentemente da responsabilidade individual.;A responsabilidade da pessoa jurídica é objetiva, ou seja, não depende de dolo ou culpa.;Não se aplica.
Direito Administrativo;Responsabilidade Civil do Estado;Banca Padrão;Médio;Caio adquire específico imóvel, para fins empresariais, situado no meio da Rua Júlio Cesar, no Município WXZ. A referida rua possui um grande movimento, o que potencializa os atos mercantis que passou a realizar em seu imóvel, por meio da sociedade empresária que criou. Passados três anos, sua atividade empresarial está obtendo um alto ganho financeiro. Neste momento, a Administração Pública Municipal, diante da necessidade de realizar uma obra emergencial, procede à ocupação temporária da área, fechando a entrada e a saída dos transeuntes, salvo os residentes. Essa situação perdura por oito meses e acarreta o estado de inviabilidade financeira para o estabelecimento empresarial de Caio. Sobre essa situação, assinale a opção que melhor reflete o direito que a empresa criada por Caio teria em face do Poder Público municipal, segundo as regras brasileiras.;A sociedade empresária apenas terá direito a ser indenizada se o tempo de realização da obra tiver ficado acima da média temporal para obras como a realizada, ciente de ser uma responsabilidade de natureza subjetiva.;A sociedade empresária apenas terá direito a ser ressarcida se comprovar que o Município foi levado a realizar as obras por conta de uma situação emergencial cuja causa tenha ligação direta com uma conduta do próprio Município.;O direito da sociedade empresária se restringir-se-á ao não pagamento de eventuais tributos municipais incidentes, pois a edilidade teria dado causa ao esvaziamento de sua atividade, não podendo cobrar tributos diante dessa situação.;A sociedade empresária teria direito a ser ressarcida pelo atingimento econômico de suas atividades, de forma objetiva, pois a conduta do Município teve direta relação com a inviabilidade de bem prestar suas atividades empresariais.;A sociedade empresária não terá direito a ser ressarcida pelo atingimento econômico de suas atividades, pois a situação ocorrida está dentro de um risco negocial, sendo previsível que o poder público possa ser levado à realização de obras que venham a interferir na circulação de vias públicas.;d;O Estado é responsável objetivamente por danos causados por atos lícitos ou ilícitos. No caso, a obra pública causou dano econômico à empresa, cabendo indenização.;A responsabilidade do Estado é objetiva, baseada na teoria do risco administrativo.;Não se aplica.
Direito Administrativo;Prescrição contra a Fazenda Pública;Banca Padrão;Médio;Objetivando estabelecer a segurança nas relações jurídicas, ao retirar a possibilidade de situações financeiras perdurarem por tempo indeterminado, o Decreto Lei nº 20.910/1932 estabeleceu regras sobre prazos prescricionais quanto a direito ou ação contra a Fazenda federal, estadual ou municipal. Sobre as regras mencionadas nessa legislação, assinale a afirmativa correta.;A citação inicial interrompe a prescrição, mesmo quando, por qualquer motivo, o processo tenha sido anulado.;O direito à reclamação administrativa que não tiver prazo fixado em disposição de lei especial prescreve em três anos, a contar do conhecimento do ato ou fato apontado pelo particular prejudicado.;A prescrição interrompida recomeça a correr, por dois anos e meio, a partir do ato interruptivo, mas não poderá ficar reduzida aquém de cinco anos, mesmo que o ato interruptivo se dê durante a primeira metade do prazo.;"A prescrição somente poderá ser interrompida duas vezes, quando se trata de ação objetivando reparação material; já quando a pretensão versar sobre reparação moral, ela será interrompida sempre, segundo os regramentos da legislação civil.";Não corre a prescrição durante a demora do procedimento que está voltado a analisar ou estudar a pretensão deduzida no âmbito administrativo, salvo se esta versar sobre reparação material, quando o prazo prescricional retomará o seu curso após o primeiro ano, sem a decisão administrativa.;a;De acordo com o Decreto 20.910/32, a citação interrompe a prescrição, mesmo que o processo seja anulado.;A interrupção da prescrição pela citação é efetiva, independentemente do destino do processo.;Não se aplica.
Direito Constitucional;Controle Judicial de Políticas Públicas;Banca Padrão;Difícil;O Plenário do Supremo Tribunal Federal (STF), no julgamento do Recurso Extraordinário RE 684612, com repercussão geral (Tema 698), fixou parâmetros para nortear decisões judiciais. A respeito do recente posicionamento do STF em repercussão geral sobre os parâmetros do controle jurisdicional de políticas públicas voltadas à realização de direitos fundamentais, assinale a afirmativa correta.;A decisão judicial, como regra, deverá determinar medidas claras, objetivas e pontuais a serem realizadas pelo gestor público para a implementação dos direitos fundamentais.;A decisão judicial, prioritariamente, deve se limitar a apontar as finalidades a serem alcançadas e determinar que a Administração Pública apresente um plano ou os meios adequados para alcançar tal resultado.;A intervenção do Poder Judiciário em políticas públicas voltadas à realização de direitos fundamentais, mesmo em caso de deficiência grave ou ausência do serviço, viola o princípio da separação dos poderes.;A atuação judicial deve ser pautada por critérios de razoabilidade e eficiência e deve desenvolver e apresentar o plano concreto a ser cumprido pela administração para alcançar o resultado.;A decisão judicial não deve trazer qualquer tipo de determinação ao gestor público, sob pena de interferir na discricionariedade administrativa na tomada de decisão sobre as políticas públicas a serem implementadas.;b;O STF, no Tema 698, entende que o Judiciário deve, prioritariamente, determinar que a Administração apresente um plano para implementar o direito, sem substituir a administração.;O Judiciário não deve gerir políticas públicas, mas pode determinar que a administração o faça.;Não se aplica.
Direito Administrativo;Improbidade Administrativa;Banca Padrão;Médio;Em 2020, Fernando foi condenado com trânsito em julgado por ato de improbidade administrativa que causou prejuízo ao erário, por ter culposamente permitido que a sociedade empresária Beta utilizasse bens e valores integrantes do acervo patrimonial do Município Alfa, sem a observância das formalidades legais ou regulamentares aplicáveis à espécie, na época em que Fernando exercia o cargo de Secretário Municipal de Administração. Atualmente, em sede de cumprimento de sentença, o Ministério Público está pleiteando o pagamento de multa civil a que Fernando fora condenado na ação de improbidade. A defesa de Fernando, no entanto, alegou na execução que, diante da reforma da Lei de Improbidade Administrativa pela Lei nº 14.230/21, a multa não mais é devida. Diante da situação fática e jurídica narrada, alinhado ao entendimento do Supremo Tribunal Federal sobre o tema, o magistrado deve;acatar a tese defensiva e extinguir a execução, diante da aplicação do princípio da retroatividade da lei mais benéfica para o réu em matéria de direito sancionador, haja vista que a Lei nº 14.230/2021 revogou todas as hipóteses de atos de improbidade administrativa culposos.;acatar a tese defensiva e extinguir a execução, diante da aplicação dos princípios da isonomia e da segurança jurídica, pois a Lei nº 14.230/2021 revogou expressamente o tipo de ato de improbidade administrativa praticado por Fernando, aplicando-se, por analogia in bonam partem, o instituto da abolitio criminis.;acatar a tese defensiva e extinguir a execução, haja vista que a Lei nº 14.230/2021, por possuir conteúdo de direito material em tema de direito sancionador, aplica-se retroativamente a todos os processos de conhecimento e de execução em curso que tenham por objeto responsabilização por ato de improbidade administrativa.;rejeitar a tese defensiva e prosseguir a execução, pois a revogação da modalidade culposa do ato de improbidade administrativa, promovida pela Lei nº 14.230/2021, é irretroativa, de modo que os seus efeitos não têm incidência em relação à eficácia da coisa julgada, nem durante o processo de execução das penas e seus incidentes.;rejeitar a tese defensiva e prosseguir a execução, pois não houve revogação do tipo e do elemento subjetivo da culpa no ato de improbidade administrativa praticado por Fernando, pois os dispositivos da Lei nº 14.230/2021 são objeto de interpretação conforme a Constituição, para manter a culpa na configuração dos atos ímprobos que causem prejuízo ao erário.;d;A Lei 14.230/21 revogou a modalidade culposa, mas a retroatividade não atinge sentença transitada em julgado, conforme entendimento do STF.;A lei mais benéfica aplica-se a processos em curso, mas não aos já julgados.;Não se aplica.
Direito Administrativo;Processo Administrativo Disciplinar;Banca Padrão;Médio;Carlos, servidor público efetivo federal, no exercício das funções, praticou ato de insubordinação grave em serviço, que foi categoricamente comprovado no curso de regular processo administrativo disciplinar (PAD), que ensejou a imposição de pena de demissão ao servidor. Inconformado, Carlos ajuíza ação judicial, pleiteando a reforma da decisão administrativa, a fim de que lhe seja aplicada penalidade disciplinar menos gravosa, haja vista que comprovou nunca ter sido anteriormente sancionado, nem mesmo respondido a PAD, além de que constam em sua folha de assentamento funcional dois elogios. Com base na Lei nº 8.112/90 e na jurisprudência do Superior Tribunal de Justiça, o magistrado deve julgar a pretensão de Carlos;procedente, porque, diante dos bons antecedentes e da ausência de reincidência, o Estatuto dos Servidores Públicos Civis da União prevê que a penalidade disciplinar cabível para o caso em tela é a advertência, que será aplicada pela Administração Pública por escrito e de forma reservada e, em razão disso, Fernando deve ser imediatamente reintegrado ao cargo.;improcedente, haja vista que, apesar de o controle jurisdicional do PAD não se restringir ao exame da regularidade do procedimento e da legalidade do ato, sendo possível, em regra, incursão no mérito administrativo, por se tratar de direito administrativo sancionador, Fernando praticou ato de insubordinação grave em serviço que deve ser punido com demissão ou suspensão, conforme discricionariedade do administrador.;procedente, uma vez que, na aplicação das penalidades, devem ser consideradas a natureza e a gravidade da infração cometida, os danos que dela provierem para o serviço público, as circunstâncias atenuantes e os antecedentes funcionais, de maneira que a sanção de demissão deve ser substituída pela suspensão por 90 (noventa) dias, após o que será o servidor reintegrado.;improcedente, haja vista que, não obstante a autoridade administrativa possuir discricionariedade para aplicar ao servidor pena diversa de demissão quando caracterizadas as hipóteses legais dessa sanção de demissão mas houver atenuantes objetivas e subjetivas, o Poder Judiciário não pode se imiscuir no mérito administrativo, pois sua análise se restringe aos aspectos de legalidade do PAD, à luz dos princípios do contraditório, da ampla defesa e do devido processo legal.;improcedente, pois a autoridade administrativa que impôs a sanção disciplinar agiu corretamente, uma vez que não dispõe de discricionariedade para aplicar ao servidor pena diversa de demissão quando caracterizadas as hipóteses legais dessa sanção.;e;A insubordinação grave é hipótese de demissão, conforme art. 132, VIII, da Lei 8.112/90. A autoridade não tem discricionariedade para aplicar pena diversa.;A demissão é obrigatória para insubordinação grave.;Não se aplica.
Direito Administrativo;Licitações;Banca Padrão;Médio;O Município Alfa instaurou processo administrativo visando à contratação que tem por objeto a coleta, o processamento e a comercialização de resíduos sólidos urbanos recicláveis ou reutilizáveis, em áreas com sistema de coleta seletiva de lixo. No curso do processo, restou identificada a Cooperativa Delta, formada exclusivamente de pessoas físicas de baixa renda reconhecidas pelo poder público como catadores de materiais recicláveis, com o uso de equipamentos compatíveis com as normas técnicas, ambientais e de saúde pública. Assim, a municipalidade está em vias de efetivar a contratação direta da Cooperativa Delta, sem prévio processo licitatório, mediante dispensa de licitação. A sociedade empresária Beta, que atua no ramo de resíduos sólidos e possui um aterro sanitário legalizado, inclusive com a devida licença ambiental, pretende ser contratada para o mesmo objeto antes descrito e ajuizou ação judicial pleiteando, em sede de tutela de urgência inibitória, a proibição de contratação do serviço pretendido pelo Município Alfa sem prévia licitação. Conclusos os autos, o magistrado, atento à Lei nº 14.133/21, deve;deferir a liminar, pois a natureza do serviço a ser contratado pelo Município Alfa exige prévia licitação, cuja modalidade será determinada pelo valor estimado da contratação.;deferir a liminar, pois a natureza do serviço a ser contratado pelo Município Alfa exige prévia licitação, na modalidade pregão, que é obrigatória para aquisição de serviços comuns, cujo critério de julgamento poderá ser o de menor preço ou o de maior desconto.;deferir a liminar, pois a natureza do serviço a ser contratado pelo Município Alfa exige prévia licitação, na modalidade diálogo competitivo, em que a Administração Pública realiza diálogos com licitantes previamente selecionados mediante critérios objetivos, com o intuito de desenvolver uma ou mais alternativas capazes de atender às suas necessidades.;indeferir a liminar, pois, não obstante a contratação pretendida pelo Município Alfa não ser possível mediante dispensa de licitação, é cabível, na hipótese, a contratação direta mediante inexigibilidade de licitação, bastando que a municipalidade convalide os atos administrativos já praticados.;indeferir a liminar, pois a contratação pretendida pelo Município Alfa é possível mediante dispensa de licitação, por expressa previsão legal, desde que seja instruída com os documentos indicados na legislação de regência.;e;A Lei 14.133/21, art. 74, VI, permite a dispensa de licitação para contratação de cooperativas de catadores de materiais recicláveis.;A dispensa de licitação para cooperativas de catadores está prevista na lei de licitações.;Não se aplica.
Direito Administrativo;Responsabilidade Civil do Estado;Banca Padrão;Médio;Na capital do Estado Alfa, profissionais da área de saúde realizaram manifestação pública por melhores condições de trabalho e salariais. Criminosos se infiltraram no meio da passeata, para subtrair pertencentes dos manifestantes, em especial aparelhos celulares, ocasião em que a Polícia Militar chegou ao local para reprimir os delitos. Durante a atuação da polícia, Pedro, jornalista que cobria o evento, apesar de não ter descumprido ostensiva e clara advertência quanto ao acesso a áreas definidas como de grave risco a sua integridade física, acabou sendo lesionado por ter sido atingido pelo cassetete arremessado por um policial militar, em situação de evidente tumulto entre policiais e manifestantes. Diante do documentado dano material que sofreu por ter seu braço quebrado, Pedro ajuizou ação indenizatória em face do Estado Alfa. Após o regular curso processual, o feito foi concluso para sentença e o magistrado, observando a jurisprudência do Supremo Tribunal Federal, deve julgar a pretensão indenizatória de Pedro;procedente, diante da responsabilidade civil objetiva do Estado, não incidindo a excludente da responsabilidade da culpa exclusiva da vítima.;procedente em parte, diante da responsabilidade civil subjetiva do Estado, incidindo a excludente da responsabilidade da culpa exclusiva da vítima apenas para fins de compensação no valor da indenização.;improcedente, uma vez que, apesar da responsabilidade civil subjetiva do Estado, não ficou demonstrado abuso ou excesso na conduta policial.;improcedente, uma vez que, apesar da responsabilidade civil objetiva do Estado, incide a excludente da responsabilidade do caso fortuito ou força maior.;improcedente, uma vez que, apesar da responsabilidade civil objetiva do Estado, incide a excludente da responsabilidade da culpa exclusiva de terceiro.;a;O Estado é responsável objetivamente por danos causados por agentes públicos, e não há excludente no caso, pois a vítima não contribuiu para o dano.;A responsabilidade do Estado é objetiva, e a excludente de culpa exclusiva da vítima não se aplica.;Não se aplica.
Direito da Magistratura;Ética Judicial;Banca Padrão;Fácil;A juíza Joana, que acabou de se tornar vitalícia, foi convidada por veículo de imprensa para dar uma entrevista sobre determinado caso. Preocupada com as cautelas que deve adotar, Joana verificou que, de acordo com o Código de Ética da Magistratura Nacional, editado pelo Conselho Nacional de Justiça, deve;abster-se de emitir opinião sobre processo pendente de seu julgamento, mas pode fazê-lo em relação ao processo que será julgado por outro magistrado.;abster-se de emitir juízo depreciativo sobre despachos, votos, sentenças ou acórdãos, de órgãos judiciais, ressalvada a crítica nos autos, doutrinária ou no exercício do magistério.;observar que, caso se manifeste sobre processo pendente de seu julgamento, não poderá fazer juízo de valor sobre fatos ainda não decididos e deverá automaticamente se declarar suspeita para prosseguir no feito após a entrevista.;observar os sigilos legais decretados em processos judiciais, somente podendo dar entrevista porque já adquiriu a vitaliciedade, que, no primeiro grau, é adquirida após dois anos de exercício.;observar os sigilos legais decretados em processos judiciais, mas não lhe é exigido que evite comportamentos que impliquem a busca injustificada e desmesurada por reconhecimento social, mormente a autopromoção em publicação de qualquer natureza.;b;O Código de Ética da Magistratura veda ao juiz emitir juízo depreciativo sobre decisões de outros magistrados, exceto em críticas nos autos, doutrinárias ou no magistério.;A crítica a decisões de outros magistrados só é permitida em determinados contextos.;Não se aplica.
Direito da Criança e do Adolescente;Trabalho Infantil;Banca Padrão;Médio;No plano internacional, as duas principais normas a respeito do trabalho do adolescente são as Convenções da Organização Internacional do Trabalho nº 138, de 1973, sobre a idade mínima de admissão ao emprego, e nº 182, de 1999, sobre as piores formas de trabalho infantil. No plano nacional, o Estatuto da Criança e do Adolescente de 1990, do Art. 60 ao 69, prevê o direito à profissionalização e à proteção no trabalho infantil. Baseado nas normas internacionais e internas de proteção à criança e ao adolescente, além da CRFB/88, analise as afirmativas a seguir. I. A CRFB/88 proíbe o trabalho noturno, perigoso e insalubre a menores de 18 anos e de qualquer trabalho a menores de 16 anos, salvo na condição de aprendiz a partir de 14 anos. II. A Convenção 182 estipula que o trabalho nas atividades consideradas como piores formas de trabalho é proibido antes dos 16 anos de idade. III. É permitida qualquer atividade laboral realizada por adolescentes menores de 14 anos que se mostre imprescindível à sobrevivência e ao sustento do próprio trabalhador infantil e de sua família. IV. A doutrina da proteção integral da criança e do adolescente tem, como um de seus desdobramentos, a doutrina da situação irregular, ambas albergadas pelo Estatuto da Criança e do Adolescente (ECA). Está correto o que se afirma em;I, apenas.;IV, apenas.;I e IV, apenas.;II e III, apenas.;I e II, apenas.;a;A afirmativa I está correta conforme a CF. A II está incorreta porque a Convenção 182 proíbe as piores formas de trabalho para menores de 18 anos. A III está incorreta porque o trabalho é proibido antes dos 16 anos, salvo aprendiz a partir de 14. A IV está incorreta porque a doutrina da situação irregular foi substituída pela proteção integral.;A CF proíbe trabalho antes dos 16 anos, salvo aprendiz a partir de 14.;Não se aplica.
