disciplina;materia;banca;dificuldade;enunciado;alternativa_a;alternativa_b;alternativa_c;alternativa_d;alternativa_e;resposta_correta;justificativa;dica;formula
Língua Portuguesa;Gêneros Textuais;Média;Observe a tradução de um fragmento textual francês: “Na origem, a casa tinha sido acoplada a um computador, como tantas outras, a um computador previsional encarregado de a fazer evoluir em função dos cálculos de probabilidade de que se alimentava a máquina. A eventualidade de um inverno frio fazia com que surgisse um engrossamento progressivo das paredes, num isolamento reforçado. Uma dupla camada de telhas crescia lentamente sobre o teto, uma lareira suplementar emergia do solo como um legume perfurando a terra de um jardim.” Trata-se, no caso, de uma narrativa de ficção científica; a característica desse gênero narrativo que se aplica a esse segmento textual, é:;localização em um tempo futuro, que é visto como passado, a ponto de ser narrado;narrativa que envolve um mundo cujos elementos são completamente desconhecidos do leitor atual;apresentação de uma visão pessimista do mundo futuro, governado por máquinas incontroláveis;sugestão de uma tecnologia avançada, não criada pelos humanos, mas por seres superdotados;narrativa em que o próprio narrador mostra desconhecimento da realidade narrada;A;A ficção científica frequentemente narra eventos futuros como se fossem passados, criando uma sensação de historicidade para tecnologias e eventos ainda não existentes.;;
Língua Portuguesa;Interpretação de Texto;Fácil;Um escritor espanhol, conhecido por sua preocupação com o idioma, produziu a seguinte frase: “Estudar latim é como colocar as palavras para fazer ginástica”. Isso significa que:;o estudo de latim é hoje uma tarefa inútil, pois os estudos históricos perderam valor;o conhecimento do latim melhora a qualidade redacional de nossos textos;estudar a língua latina faz com que se acrescentem muitos novos vocábulos aos dicionários;o aprendizado da língua latina é indispensável para o conhecimento de nosso próprio idioma;estudar latim faz com que aprofundemos o conhecimento das palavras;E;"A metáfora da ""ginástica"" sugere um exercício que fortalece e aprofunda a compreensão e o uso das palavras, não necessariamente melhorando a redação ou sendo indispensável, mas sim promovendo um conhecimento mais profundo.";;;
Língua Portuguesa;Interpretação de Texto;Média;“Por que você escreve? A essa pergunta Balzac respondeu: para ser rico e célebre. Outros responderão certamente: porque é um ato necessário a meu equilíbrio psíquico, eu escreveria mesmo que eu não fosse publicado. Essas são as duas respostas extremas. Eu direi quanto a mim: para ser lido. Eu me considero como um artesão em sua oficina, aperfeiçoando esse objeto manufaturado destinado a ser vendido, um livro. Um livro é uma criação, que comporta um primeiro e um segundo grau. No primeiro, eu invento uma história e personagens. No segundo, o leitor se apoia no que inventei e persegue minha criação para torná-la sua. E como toda criação traz alegria, há para mim uma dupla felicidade: a de criar e a de suscitar uma criação entre meus leitores. Eu acendo um fogo que me dá calor e luz, mas eu o expando e observo milhões de pequenas luzes tremulando sobre toda a terra, feitas nos espíritos e corações por minhas obras” (Michel Tournier, Libération, 1985). Sobre a significação desse pequeno texto, é correto afirmar que:;segundo o texto, no fundo, todos escrevem pelo mesmo motivo: tornarem-se ricos e célebres;em resumo, os escritores pretendem trazer felicidade aos homens, mesmo que não sejam publicados;o autor do texto responde à pergunta inicial, apoiado em sua experiência pessoal, destacando o poder da criação;escrever é uma experiência que requer dedicação e trabalho a fim de que o livro possa ser amplamente consumido;os autores criam histórias e personagens para que os leitores se sintam motivados a criarem os seus;C;"O autor centraliza sua resposta na sua experiência pessoal (""Eu direi quanto a mim""), enfatizando o ato de criar e a interação criativa com o leitor.";;;
Língua Portuguesa;Argumentação;Fácil;“O gerente da empresa comentou que, com a futura chegada dos bombeiros, o incêndio seria controlado e a produção poderia ser entregue dentro do prazo.” A argumentação do gerente mostra um problema, que é:;a fuga do assunto, já que o foco deveria ser o incêndio;uma generalização excessiva já que nem todos os incêndios conseguem ser apagados a tempo;um argumento autoritário, já que ele sozinho decide o que fazer com a produção;a apresentação de uma possibilidade como certeza;o estabelecimento de uma relação equivocada entre causa e efeito;D;"O gerente trata a chegada dos bombeiros e o controle do incêndio como certezas (""seria controlado""), quando na realidade são apenas possibilidades ou probabilidades.";;;
Língua Portuguesa;Coesão Textual;Média;Um dos problemas continuamente apontados em textos escritos é o da repetição de termos idênticos; em todas as frases abaixo, esse problema foi combatido por meio de substituições. A opção em que a substituição foi realizada por meio de um processo diferente dos demais, é:;O coronel tinha muito orgulho da farda, como ocorre com a grande maioria dos militares;Essa noite relampejou e trovejou muito, e os pobres cachorros, com medo desses fenômenos, latiram desesperadamente;Subir e descer escadas, caminhar uma hora por dia foram exercícios recomendados pelo médico do idoso;Os alunos pretendiam homenagear a professora, mas nem todos os alunos concordaram com a homenagem;Era muito simpático, característica que todos admiravam nele;D;"Nas opções A, B, C e E, a substituição foi feita por sinônimos, hiperônimos ou expressões resuntivas. Na opção D, a repetição do termo ""alunos"" não foi substituída, caracterizando o processo diferente (não ter sido evitada).";A questão pede a opção em que o processo de substituição é DIFERENTE. Atenção à interpretação.;
Língua Portuguesa;Coesão Textual;Difícil;Entre as opções abaixo há um termo destacado cujo referente se encontra após a sua enunciação, exemplificando o que se chama de “catáfora”; a opção em que isso ocorre, é:;Todos aqueles que os citam são admiradores dos ministros;O quadro, ele foi adquirido ontem;Choveu muito e isso não surpreende mais;Não vi o buraco onde caíram os óculos;A semana em que ele chegou foi no início do mês;A;"O pronome ""os"" antecipa e refere-se a ""ministros"", que aparece depois na frase. Isso é um exemplo de catáfora.";Catáfora é quando um termo (geralmente um pronome) se refere a algo que será mencionado posteriormente no texto.;
Língua Portuguesa;Sintaxe;Média;A frase abaixo que mostra ambiguidade em função de NÃO se poder distinguir agente e paciente, é:;O chefe encontrou o funcionário em seu gabinete;A criação da instituição demorou mais do que se esperava;João e Maria se casaram ontem;Encontrei o assaltante andando pela rua;Chamar os bombeiros já ficou na moda;B;"Na frase ""A criação da instituição..."", ""criação"" pode ser entendida como o ato de criar (alguém criou a instituição) ou a instituição que foi criada. Essa ambiguidade envolve a noção de agente e paciente do ato de criar.";Ambiguidade estrutural: observe se a mesma palavra pode ser interpretada como uma ação ou o resultado da ação.;;
Língua Portuguesa;Sintaxe;Fácil;A opção abaixo em que está presente uma forma interrogativa indireta é:;A classe política declarou-se satisfeita após a publicação do calendário eleitoral;Os sindicatos e os representantes patronais retomaram seus afazeres;As empresas de computação ainda não sabem quando vão instalar os novos computadores;Por que todos os adolescentes parecem inventar o mundo de novo?;Todos sabem quanto custa esse automóvel;C;"A oração ""quando vão instalar os novos computadores"" é uma interrogativa indireta, pois depende de um verbo de elocução ou pensamento (""não sabem"") e não possui marca de interrogação direta.";Interrogativa indireta não vem acompanhada de ponto de interrogação e é introduzida por um verbo de pergunta, dúvida ou conhecimento.;;
Língua Portuguesa;Verbos;Média;A opção abaixo em que a forma verbal destacada mostra fatos anteriores em relação aos outros é:;Quando a guerra da Ucrânia terminar, muitos vão voltar ao país;Ela já terminara os exercícios quando os pais chegaram para levá-la;O diretor entrou em sala quando a maioria já saíra;O professor estava no quadro quando o aluno entrou;Todos vão saber o resultado amanhã à tarde;B;"O verbo ""terminara"" (pretérito mais-que-perfeito) indica uma ação concluída antes de outra ação passada (""chegaram"").";O pretérito mais-que-perfeito indica uma ação passada anterior a outra ação também passada.;;
Língua Portuguesa;Tipologia Textual;Fácil;Observe a seguinte explicação, retirada de uma gramática de língua portuguesa: “O adjetivo é uma das classes de palavras, caracterizada por ser variável em gênero e número, determinante de um substantivo ou pronome substantivo, expressando estado, característica, qualidade ou relação”. Sobre esse pequeno texto explicativo, é correto afirmar que o texto:;se estrutura a partir de uma pergunta explícita, seguida de uma resposta que lhe dá explicação;comporta definições, destacadas por palavras que as apresentam;mostra muitos conectores lógicos, que introduzem explicações;mostra termos especializados não explicados em função de dirigir-se a leitores com certos conhecimentos;mostra comparações e esquemas que permitem visualizar a explicação de forma mais clara;D;"O texto utiliza termos como ""classe de palavras"", ""variável em gênero e número"", ""substantivo"", ""pronome substantivo"" sem explicá-los, pressupondo que o leitor já tenha esse conhecimento.";Textos didáticos ou técnicos frequentemente pressupõem um conhecimento prévio do leitor.;;
Língua Portuguesa;Variação Linguística;Média;Um livro intitulado _A Língua Portuguesa e o Modernismo traz_ algumas modificações ocorridas na norma culta de nossa língua na época moderna; a opção abaixo que mostra uma dessas modificações seguida de um exemplo que a comprove, de forma adequada, é:;uso do pronome “ele/eia” como objeto direto, em lugar de “o/a”: “Nós vimos que ele não chegaria a tempo”;uso do pronome “mim” em lugar de “eu”: “Para mim, trabalhar lá deve ser um sacrifício”;emprego de pronome oblíquo solto entre dois verbos: “Ele foi se pentear no espelho do banheiro”;utilização do verbo “ter” em lugar de “haver”: “Ele não tinha mais o que fazer no trabalho”;uso da forma “lhe” em lugar de “o/a”: “Eu lhe entreguei os livros prometidos”;C;"O Modernismo brasileiro, em sua busca por uma linguagem mais coloquial e brasileira, incorporou construções como ""foi se pentear"", onde o pronome ""se"" aparece entre os verbos, uma característica da fala informal que passou a ser mais aceita.";O Modernismo buscava aproximar a língua escrita da falada.;
Língua Portuguesa;Figuras de Linguagem;Média;Todas as frases abaixo trazem metáforas ou comparações; a opção em que o motivo da comparação está identificado de forma adequada, é:;Meu pai sempre trabalhou como um escravo / com baixos salários;O carro passou pela avenida como um foguete / soltando fogo pelo cano traseiro;O menino declarou que a avó parecia uma bruxa / andava com uma vassoura;Em sala de aula, meu professor de História parecia uma biblioteca / carregava muitos livros consigo;A sala de jantar dos meus avós era tal qual um museu / cheia de coisas velhas e malcuidadas;E;"A comparação com ""museu"" é justificada pela característica de ter ""coisas velhas e malcuidadas"", que é uma associação típica (embora não necessariamente precisa) de um museu desorganizado.";"O ""motivo da comparação"" é o elemento comum que justifica a analogia entre os dois termos.";
Língua Portuguesa;Sintaxe;Difícil;Todos os pensamentos abaixo trazem orações adjetivas destacadas; a opção em que essa oração foi substituída por um adjetivo de forma adequada, é:;Uma ideia medíocre que desperta entusiasmo irá mais longe que uma grande ideia que não inspira entusiasmo algum / motivadora;Nosso grande erro é tentar obter de cada um as virtudes que não possuem e desdenhar o aprimoramento das que possuem / encarecedoras;A única coisa que vem sem esforço é a idade / inevitável;Há mais pessoas que desistem do que pessoas que fracassam / desestimuladas;Não se pode confiar em quem não confia em ninguém / nos confiantes;C;"A oração adjetiva ""que vem sem esforço"" pode ser adequadamente substituída pelo adjetivo ""inevitável"" no contexto, mantendo a ideia de algo que não se pode evitar.";"A substituição deve manter o sentido original da oração. ""Inevitável"" capta bem a ideia de algo que acontece independente do esforço.";
Língua Portuguesa;Argumentação;Média;“Aconteceu aos verdadeiros sábios o que se verifica com as espigas de milho, que se ergueram orgulhosamente enquanto vazias e, quando se enchem e amadurece o grão, se inclinam e se dobram humildemente. Assim esses homens, depois de tudo terem experimentado, sondado e nada haverem encontrado nesse amontoado considerável de coisas tão diversas, renunciaram à sua presunção e reconheceram a sua insignificância.” Sobre a base argumentativa desse pensamento de Montaigne, é correto afirmar que:;a tese do texto é a de que os verdadeiros sábios se inspiram nas espigas de milho;o argumento básico do texto é de base comparativa, citando o exemplo das espigas de milho;a argumentação apresentada é a experiência pessoal do autor, filósofo e escritor;o público-alvo do texto são os verdadeiros sábios, que não interrompem a trajetória do aprendizado;a lição do texto é a de que a humildade, também na natureza, só não é seguida pelos verdadeiros sábios, por já possuírem o conhecimento;B;O texto constrói seu argumento central fazendo uma analogia entre o comportamento dos sábios e o das espigas de milho, usando a comparação como base para a argumentação.;"A estrutura ""Aconteceu... o que se verifica com..."" indica uma comparação que serve de argumento.";;
Língua Portuguesa;Semântica;Média;Todas as frases abaixo foram iniciadas com o vocábulo “Segundo”, com noção de conformidade; se eliminarmos das frases esse vocábulo, mantendo-se o sentido original, a única forma adequada é:;Segundo a Fifa, o jogador do Grêmio deve ser suspenso por três anos / A Fifa manda que o jogador do Grêmio seja suspenso por três anos;Segundo o regulamento do prédio, o morador que deixou lixo no corredor deve ser multado / O regulamento do prédio comenta que o morador que deixou lixo no corredor devesse ser multado;Segundo o Denatran, ninguém pode dirigir sem carteira de habilitação / O Denatran instrui como obter-se a carteira de habilitação, que é obrigatória;Segundo o edital do concurso, a prova tem a duração de quatro horas / O edital do concurso ordena que a prova tenha a duração de quatro horas;Segundo o Serviço de Meteorologia, as chuvas não vão cair neste final de semana / O Serviço de Meteorologia preceitua que as chuvas não vão cair nesse final de semana;A;"A substituição por ""A Fifa manda que"" mantém a noção de conformidade com uma regra ou determinação emanada daquele órgão, que é a ideia transmitida por ""Segundo a Fifa"".";Segundo indica conformidade com uma fonte. A substituição deve manter a ideia de que a informação vem dessa fonte como uma regra, declaração ou previsão.;
Língua Portuguesa;Reescritura de Textos;Fácil;Entre os segmentos abaixo, aquele que se mostra bastante objetivo, sem pormenores inúteis, repetições desnecessárias ou redundâncias, é:;Cada candidato, individualmente, terá acesso às informações do concurso por meio de uma senha particular;O governo deve devolver ao povo o valor do empréstimo temporário cobrado no preço dos alimentos;Ocorreu uma verdadeira balbúrdia no momento em que Trump entrou no tribunal;Na volta da guerra, os militares receberam amor e afeto de seus familiares, que os aguardavam ansiosos;Os atletas ficaram desestimulados ao se depararem com a grande quantidade de obstáculos na pista;E;"A opção E é a mais direta e objetiva, sem redundâncias como ""cada... individualmente"" (A), ""verdadeira balbúrdia"" (C) ou ""amor e afeto"" (D).";Objetividade evita pleonasmos e palavras desnecessárias.;;
Língua Portuguesa;Formação de Palavras;Média;Os segmentos destacados em cada uma das frases foram substituídos por um só vocábulo de mesmo sentido, com a ajuda de um afixo (prefixo e sufixo); a única frase em que esse procedimento foi feito de forma adequada, é:;O paciente mostrava uma inflamação conjunta dos órgãos do sistema urinário / uma conjuntivite;A câmara descoberta há pouco tempo na pirâmide do Egito foi uma enorme surpresa arqueológica / pré-descoberta;Analisar-se a si mesmo continuamente é um bom caminho para a paz interior / autoanalisar-se;O Rio de Janeiro está sendo visitado de novo / retrovistiado;Tudo estava explicado de forma geográfica / geodicamente;C;"O termo ""autoanalisar-se"" é formado corretamente pelo prefixo ""auto-"" (a si mesmo) e o verbo ""analisar"", substituindo adequadamente ""analisar-se a si mesmo"".";"Atenção à formação correta das palavras com prefixos e sufixos. ""Conjuntivite"" é específica dos olhos, não do sistema urinário.";
Língua Portuguesa;Relações Analógicas;Fácil;A frase abaixo que apresenta uma relação lógica corretamente estabelecida, é:;audição está para som como paladar está para língua;livro está para capa como travesseiro está para fronha;álcool está para alcoolismo como droga está para traficante;tecido está para desbotar como papel está para rasgar;mestre está para discípulo como professor está para escola;B;A relação é de proteção/cobertura: a capa protege o livro, assim como a fronha protege/cobre o travesseiro.;Identifique a relação semântica (função, parte-todo, causa-efeito, etc.) entre os primeiros termos e verifique se é a mesma entre os segundos.;;
Língua Portuguesa;Figuras de Linguagem;Média;Uma das estratégias de diminuir o ser humano é usar para ele vocábulos empregados somente ou também para coisas (reificação); a frase abaixo em que foi empregado esse processo, é:;Apesar de craque, em alguns jogos Pelé parecia desligado;Nem toda pessoa domina os nervos;Os professores não perdem a paciência facilmente;Havia grande quantidade de pessoas na festa;Os artistas prometeram fazer um bom show;A;"A expressão ""desligado"" (como um aparelho) é usada para se referir a um estado mental de uma pessoa, caracterizando a reificação.";Reificação (ou coisificação) é tratar uma pessoa ou qualidade humana como se fosse uma coisa ou objeto.;
Direito Constitucional;Previdência;Difícil;João, ocupante de cargo de provimento efetivo no Município Alfa, ente federativo que possui Regime Próprio de Previdência Social, foi eleito para o cargo de deputado estadual na Assembleia Legislativa do Estado Beta. O Estado Beta também possui regime próprio de previdência social. À luz da sistemática constitucional, é correto afirmar que João, ao iniciar o exercício do mandato eletivo de deputado estadual:;será filiado ao regime geral de previdência social;será filiado ao regime próprio de previdência social do Estado Beta;permanecerá filiado ao regime próprio de previdência social do Município Alfa;poderá optar pela filiação ao regime próprio de previdência social, qualquer que seja ele, ou pelo regime geral de previdência social;poderá optar pela filiação ao regime próprio de previdência social do Estado Beta ou ao regime próprio de previdência social do Município Alfa;C;De acordo com o § 15 do art. 40 da CF, o servidor titular de cargo efetivo eleito para mandato eletivo optará pela remuneração do mandato e permanecerá filiado ao regime de origem.;;;
Direito Constitucional;Competências Legislativas;Difícil;O Estado Alfa, no exercício de competência legislativa concorrente com a União, editou a Lei nº XX. Esse diploma normativo dispôs sobre temática em relação à qual a União ainda não tinha legislado. Poucos anos depois, a União editou a Lei nº YY, que veiculou normas gerais sobre a temática em sentido totalmente diverso daquele realizado pela Lei nº XX. À luz da sistemática constitucional, é correto afirmar que:;a Lei nº YY, por ser superveniente, revogou a Lei nº XX;a Lei nº YY apenas suspendeu a eficácia da Lei nº XX, não a revogando;a Lei nº XX se tornou inválida em razão da superveniência da Lei nº YY;a Lei nº XX é inconstitucional, pois não poderia ter sido editada sem a prévia edição de lei da União;a Lei nº XX, em razão do princípio da prevalência do interesse, continuará a ser aplicada no Estado Alfa;B;Na competência concorrente, a superveniência de lei federal de normas gerais suspende a eficácia da lei estadual no que lhe for contrário (CF, art. 24, § 3º e § 4º).;;;
Direito Constitucional;Direito Internacional Privado;Difícil;Johan, de nacionalidade austríaca, faleceu e deixou duas herdeiras, Joana e Marya, suas filhas, tendo a primeira delas dupla nacionalidade, a brasileira e a austríaca, e a segunda, nacionalidade austríaca. Embora tenha falecido na Áustria, Johan deixou bens no território brasileiro. Em razão desse quadro, Joana procurou um advogado e o questionou a respeito da lei que deveria reger a sucessão dos bens situados no Brasil, considerando a sua situação pessoal e a do seu falecido pai. O advogado respondeu, corretamente, que:;como Joana tem nacionalidade austríaca, a sucessão seria regida pela lei austríaca;a sucessão será regida pela lei brasileira, caso a lei austríaca não seja mais favorável a Joana;a sucessão será regida pela lei brasileira em relação a Joana e pela lei austríaca em relação a Marya;a sucessão será regida pela lei brasileira, salvo se Johan, em testamento, dispôs que seria aplicada a lei austríaca;a sucessão deve ser obrigatoriamente regida pela lei brasileira, considerando o local em que os bens se encontram;E;A Lei de Introdução às Normas do Direito Brasileiro (LINDB), em seu art. 10, § 1º, estabelece que a sucessão por morte obedece à lei do país em que o de cujus era domiciliado, mas a lei brasileira será sempre aplicada aos bens situados no Brasil.;;;
Direito Administrativo;Responsabilidade Civil do Estado;Difícil;Antônio, que atua em uma empresa pública, com personalidade jurídica de direito privado e competência para promover a coleta de lixo domiciliar no Município Alfa, distraiu-se, no exercício de sua função, e causou danos ao automóvel de Maria. Apesar das desculpas de Antônio, Maria disse que adotaria as medidas judiciais necessárias para o ressarcimento dos danos que sofrera. À luz da sistemática constitucional, é correto afirmar que Maria deve ajuizar a ação de reparação de danos em face de:;Antônio e, caso este agente não possua bens suficientes para o ressarcimento do dano, poderá postular a responsabilização de Alfa;Antônio, não sendo cabível a responsabilização de Alfa, que somente está presente quando seus agentes atuam com dolo;Antônio, não sendo cabível a responsabilização objetiva de Alfa, isto por ter personalidade jurídica de direito privado;Alfa, sendo que este ente não tem direito de regresso contra Antônio, que não atuou com dolo;Alfa, tendo este ente direito de regresso contra Antônio, que agiu com culpa;E;A responsabilidade civil do Estado é objetiva, ainda que o agente atue em empresa pública de direito privado no exercício de serviço público. O ente público (Alfa) responde objetivamente, mas tem direito de regresso contra o agente que agiu com culpa (Art. 37, §6º, CF).;;;
Direito Constitucional;Nacionalidade;Média;Ana, brasileira nata, era casada com Johan, de nacionalidade holandesa. Ao ver de Ana, o fato de ter uma nacionalidade distinta da do marido seria algo negativo e prejudicial à solidez da família. Por tal razão, decidiu se naturalizar holandesa, o que efetivamente foi feito. À luz da sistemática constitucional, é correto afirmar que Ana:;terá declarada a perda da nacionalidade brasileira;tem dupla nacionalidade, a holandesa e a brasileira, já que esta última só será cancelada caso Ana o requeira;tem dupla nacionalidade, a holandesa e a brasileira, considerando a impossibilidade de dispor desta última;terá declarada a perda da nacionalidade brasileira, caso não requeira a sua manutenção nos cinco anos seguintes;perdeu a nacionalidade brasileira, que será automaticamente restabelecida caso renuncie à nacionalidade holandesa;A;A CF/88, no art. 12, §4º, inciso II, prevê a perda da nacionalidade do brasileiro que adquirir outra nacionalidade, salvo nos casos de reconhecimento de nacionalidade originária pela lei estrangeira ou de imposição de naturalização, pela norma estrangeira, ao brasileiro residente em estado estrangeiro, como condição para permanência em seu território ou para o exercício de direitos civis. A naturalização voluntária, como no caso de Ana, acarreta a perda da nacionalidade brasileira.;A perda da nacionalidade por aquisição de outra é voluntária e não se enquadra nas exceções do §4º, II, 'a' e 'b'.;;
